{
  "$schema": "http://json-schema.org/draft-07/schema#",
  "title": "Pelican Configuration",
  "description": "Configuration for Pelican static site generator",
  "type": "object",
  "properties": {
    "author": {
      "type": "string",
      "description": "Site author name",
      "examples": ["Marco & Chrissy"]
    },
    "sitename": {
      "type": "string",
      "description": "Site title/name",
      "examples": ["Marco & Chrissy's Wedding"]
    },
    "site_url": {
      "type": "string",
      "format": "uri",
      "description": "Base URL for the site (SITEURL in Pelican)",
      "examples": ["https://example.com"]
    },
    "content_path": {
      "type": "string",
      "description": "Path to content directory (PATH in Pelican)",
      "default": "content",
      "examples": ["content", "src/content"]
    },
    "output_path": {
      "type": "string", 
      "description": "Directory where generated files will be saved (OUTPUT_PATH in Pelican)",
      "default": "output",
      "examples": ["output", "public", "dist"]
    },
    "theme": {
      "type": "string",
      "description": "Theme name or path (THEME in Pelican)",
      "default": "notmyidea",
      "examples": ["notmyidea", "simple", "/path/to/custom/theme"]
    },
    "timezone": {
      "type": "string",
      "description": "Site timezone (TIMEZONE in Pelican)",
      "default": "UTC",
      "examples": ["America/New_York", "UTC", "Europe/London"]
    },
    "default_lang": {
      "type": "string",
      "description": "Default language code (DEFAULT_LANG in Pelican)",
      "default": "en",
      "examples": ["en", "es", "fr"]
    },
    "delete_output_directory": {
      "type": "boolean",
      "description": "Delete the output directory and all contents before generating (DELETE_OUTPUT_DIRECTORY in Pelican)",
      "default": false
    },
    "ignore_files": {
      "type": "array",
      "items": {
        "type": "string"
      },
      "description": "Patterns of files/directories to ignore during processing (IGNORE_FILES in Pelican)",
      "default": [".#*", "__pycache__", "*~", "*.pyc"],
      "examples": [[".*", "*.tmp"], [".git", "node_modules", "*.pyc"]]
    },
    "static_paths": {
      "type": "array",
      "items": {
        "type": "string"
      },
      "description": "Directories containing static files to copy to output (STATIC_PATHS in Pelican)",
      "default": ["images"],
      "examples": [["images", "css", "js"], ["static", "assets"]]
    },
    "article_paths": {
      "type": "array",
      "items": {
        "type": "string"
      },
      "description": "Directories to look for articles (ARTICLE_PATHS in Pelican)",
      "default": [""],
      "examples": [["articles", "posts"], ["blog"]]
    },
    "page_paths": {
      "type": "array",
      "items": {
        "type": "string"
      },
      "description": "Directories to look for pages (PAGE_PATHS in Pelican)",
      "default": ["pages"],
      "examples": [["pages"], ["content/pages"]]
    },
    "default_pagination": {
      "type": ["integer", "boolean"],
      "description": "Number of articles per page, or false to disable pagination (DEFAULT_PAGINATION in Pelican)",
      "default": false,
      "examples": [10, 20, false]
    }
  },
  "required": ["author", "sitename", "site_url"],
  "additionalProperties": true
}